{
  "user": {
    "name": "Caroline",
    "birthDate": "1994-05-15",
    "birthTime": "14:35",
    "birthPlace": "Berlin",
    "sun": "Zwillinge",
    "moon": "Krebs",
    "ascendant": "Fische",
    "mars": "Löwe",
    "mercury": "Stier",
    "venus": "Zwillinge"
  },
  "horoscopeText": "Liebe Caroline,\n\nDein Geburtshoroskop ist eine bunte Mischung aus bemerkenswerten Eigenschaften – genau wie du. Dein Sonnenzeichen Zwillinge, dein Mondzeichen Krebs und dein Aszendent Fische spiegeln deine einzigartige Persönlichkeit wider.\n\nAls Zwilling bist du ein echter Wirbelwind, Caroline. Du bist intelligent und anpassungsfähig, und du hast eine unersättliche Neugierde, die dich ständig dazu antreibt, neue Dinge zu lernen und zu erforschen. Manchmal gehst du so sehr in deinem Wissensdurst auf, dass du ganz vergisst, dir Zeit für dich selbst zu nehmen. Aber das ist in Ordnung, denn du liebst das Gefühl, immer in Bewegung zu sein.\n\nDein Mondzeichen Krebs bringt eine größere Tiefe in deine Persönlichkeit. Es hilft dir, dein Herz zu öffnen und emotionale Bindungen zu schätzen. Du bist eine Person, die sich um andere kümmert und immer bereit ist, zuzuhören und zu unterstützen. Deine emotionale Intelligenz ist hoch und du bist in der Lage, tiefgehende emotionale Verbindungen herzustellen.\n\nDein Aszendent Fische bringt eine spirituelle Dimension in dein Leben. Du bist eine Träumerin, Caroline, und das ist etwas, das du schätzen solltest. Du hast die Fähigkeit, über den Tellerrand hinaus zu denken und das große Ganze zu sehen. Du bist intuitiv und sensibel, und das macht dich zu einer empathischen und verständnisvollen Person.\n\nMerkur im Stier verleiht dir eine pragmatische Denkweise. Du bist eine echte Problemlöserin und gehst Herausforderungen mit einer erstaunlichen Gelassenheit und Ausdauer an. Du hast eine tiefe Wertschätzung für Schönheit und Komfort und weißt, wie du dir ein gemütliches und ästhetisch ansprechendes Umfeld schaffst.\n\nMit Venus in deinem eigenen Zeichen, bist du eine echte Kommunikatorin, Caroline. Du hast ein besonderes Gespür für Worte und kannst tiefe und bedeutungsvolle Gespräche führen. Du liebst es, Ideen auszutauschen und dich mit anderen zu verbinden.\n\nMars im Löwen macht dich leidenschaftlich und mutig. Du bist eine wahre Kämpferin, die nie aufgibt und immer ihr Bestes gibt, um ihre Ziele zu erreichen. Du bist eine natürliche Führungspersönlichkeit und weißt, wie du andere inspirieren und motivieren kannst.\n\nZusammengefasst: Du bist eine starke, leidenschaftliche und einzigartige Frau, Caroline. Dein Geburtshoroskop zeigt, dass du eine tiefgründige, feinfühlige und intelligente Persönlichkeit bist. Also umarme diese Qualitäten und nutze sie, um das Leben zu leben, das du dir immer gewünscht hast. Du bist wunderbar, genau so wie du bist."
}